{
  "schemaVersion": "1.0.0",
  "project": {
    "repository": "mayajinjoon/arirang-surprisesong-tracker",
    "siteName": "BTS ARIRANG TOUR — Surprise Songs Tracker",
    "creatorBrand": "Maya Joon",
    "subject": "BTS OT7",
    "language": "en",
    "fanMade": true
  },
  "dataset": {
    "asOf": "2026-10-15",
    "completedThrough": "2026-10-14",
    "completedThroughLabel": "Santiago D1",
    "totalShows": 88,
    "completedShows": 54,
    "upcomingShows": 34,
    "confidenceNote": "Official BIGHIT MUSIC/HYBE/Weverse sources govern calendar data. Surprise-song data is independently corroborated because no official consolidated song ledger was found."
  },
  "rules": {
    "chronology": "Sort shows by ISO date ascending; performanceOrder breaks ties only within a show.",
    "firstAppearance": "Derived at runtime by scanning completed shows chronologically and marking only the first occurrence of each canonical song title. Do not store or hand-edit a firstAppearance flag.",
    "upcomingSongs": "Upcoming shows must keep surpriseSongs as an empty array. Never invent placeholders or titles.",
    "status": "completed means the show occurred and song data was checked; upcoming means officially announced but not yet completed at dataset.asOf.",
    "canonicalization": "Song titles in surpriseSongs are canonical display keys. Aliases are a presentation/search concern and must not alter chronology."
  },
  "legs": [
    {
      "id": "opening-korea-japan",
      "label": "Korea & Japan Opening Shows",
      "officialLabel": false
    },
    {
      "id": "north-america-i",
      "label": "North America — Part I",
      "officialLabel": false
    },
    {
      "id": "korea-busan",
      "label": "Busan",
      "officialLabel": false
    },
    {
      "id": "europe",
      "label": "Europe",
      "officialLabel": false
    },
    {
      "id": "north-america-ii",
      "label": "North America — Part II",
      "officialLabel": false
    },
    {
      "id": "latin-america",
      "label": "Latin America",
      "officialLabel": true
    },
    {
      "id": "asia-australia",
      "label": "Asia & Australia",
      "officialLabel": true
    }
  ],
  "sources": [
    {
      "id": "official-tour-site",
      "title": "BTS WORLD TOUR ARIRANG — Tour Dates",
      "publisher": "BIGHIT MUSIC / HYBE",
      "url": "https://btsworldtourofficial.com/",
      "type": "official-tour-calendar",
      "authority": "primary",
      "accessedAt": "2026-10-04"
    },
    {
      "id": "weverse-na-europe",
      "title": "BTS WORLD TOUR ‘ARIRANG’ IN NORTH AMERICA & EUROPE Ticket Information",
      "publisher": "BIGHIT MUSIC via Weverse",
      "url": "https://weverse.io/bts/notice/33091",
      "type": "official-announcement",
      "authority": "primary",
      "accessedAt": "2026-10-04"
    },
    {
      "id": "weverse-goyang",
      "title": "BTS WORLD TOUR ‘ARIRANG’ IN GOYANG SOUND CHECK Schedule",
      "publisher": "BIGHIT MUSIC via Weverse",
      "url": "https://weverse.io/bts/notice/33155",
      "type": "official-announcement",
      "authority": "primary",
      "accessedAt": "2026-10-04"
    },
    {
      "id": "japan-official",
      "title": "BTS WORLD TOUR ‘ARIRANG’ IN JAPAN — Schedule",
      "publisher": "BTS Japan Official",
      "url": "https://bts-official.jp/schedule/sEfPyALR162k%3D",
      "type": "official-announcement",
      "authority": "primary",
      "accessedAt": "2026-10-04"
    },
    {
      "id": "weverse-busan",
      "title": "BTS THE CITY ARIRANG — BUSAN Notice",
      "publisher": "HYBE via Weverse",
      "url": "https://weverse.io/bts/notice/35912",
      "type": "official-announcement",
      "authority": "primary",
      "accessedAt": "2026-10-04"
    },
    {
      "id": "weverse-latam",
      "title": "BTS WORLD TOUR ‘ARIRANG’ IN LATIN AMERICA Ticket Information",
      "publisher": "BIGHIT MUSIC via Weverse",
      "url": "https://weverse.io/bts/notice/34448",
      "type": "official-announcement",
      "authority": "primary",
      "accessedAt": "2026-10-04"
    },
    {
      "id": "weverse-latam-additional",
      "title": "Additional shows in Lima, Santiago and Buenos Aires",
      "publisher": "BIGHIT MUSIC via Weverse",
      "url": "https://weverse.io/bts/notice/34732",
      "type": "official-additional-show-announcement",
      "authority": "primary",
      "accessedAt": "2026-10-04"
    },
    {
      "id": "weverse-asia-australia",
      "title": "BTS WORLD TOUR ‘ARIRANG’ IN ASIA & AUSTRALIA Ticket Information",
      "publisher": "BIGHIT MUSIC via Weverse",
      "url": "https://weverse.io/bts/notice/36080",
      "type": "official-announcement",
      "authority": "primary",
      "accessedAt": "2026-10-04"
    },
    {
      "id": "weverse-melbourne-additional",
      "title": "Additional Show Information — Melbourne",
      "publisher": "BIGHIT MUSIC via Weverse",
      "url": "https://weverse.io/bts/notice/36364",
      "type": "official-additional-show-announcement",
      "authority": "primary",
      "accessedAt": "2026-10-04"
    },
    {
      "id": "weverse-jakarta-bulacan-additional",
      "title": "Additional Show Information — Jakarta & Bulacan",
      "publisher": "BIGHIT MUSIC via Weverse",
      "url": "https://weverse.io/bts/notice/36777",
      "type": "official-additional-show-announcement",
      "authority": "primary",
      "accessedAt": "2026-10-04"
    },
    {
      "id": "ap-original-calendar",
      "title": "BTS 2026–2027 tour dates",
      "publisher": "Associated Press",
      "url": "https://apnews.com/article/01db0e428723c0febc514373969333bd",
      "type": "contemporaneous-calendar-record",
      "authority": "secondary",
      "accessedAt": "2026-10-04"
    },
    {
      "id": "kpopgo-consolidated",
      "title": "BTS ARIRANG Surprise Songs Tracker 2026",
      "publisher": "KPopGo",
      "url": "https://kpopgo.art/news/bts-arirang-surprise-songs-tracker",
      "type": "consolidated-setlist-tracker",
      "authority": "secondary",
      "accessedAt": "2026-10-04"
    },
    {
      "id": "honey-pop-consolidated",
      "title": "Every BTS Surprise Song on the ARIRANG World Tour",
      "publisher": "The Honey POP",
      "url": "https://thehoneypop.com/2026/04/13/bts-surprise-songs-arirang-world-tour/",
      "type": "consolidated-setlist-tracker",
      "authority": "secondary",
      "accessedAt": "2026-10-04"
    },
    {
      "id": "setlistfm-artist",
      "title": "BTS Concert Setlists — ARIRANG Tour",
      "publisher": "setlist.fm",
      "url": "https://www.setlist.fm/setlists/bts-3bdd50e4.html",
      "type": "community-setlist-archive",
      "authority": "secondary",
      "accessedAt": "2026-10-04"
    },
    {
      "id": "setlistfm-busan-d2",
      "title": "BTS at Busan Asiad Main Stadium — 13 Jun 2026",
      "publisher": "setlist.fm",
      "url": "https://www.setlist.fm/setlist/bts/2026/busan-asiad-main-stadium-busan-south-korea-1b4afda0.html",
      "type": "show-setlist",
      "authority": "secondary",
      "accessedAt": "2026-10-04"
    },
    {
      "id": "bogota-d1-local-report",
      "title": "Concierto de BTS en Bogotá: primera noche",
      "publisher": "Minuto60",
      "url": "https://www.minuto60.com/entretenimiento-cultura/como-fue-el-primer-concierto-de-bts-en-bogota-videos-momentos/16492",
      "type": "local-concert-report",
      "authority": "secondary",
      "accessedAt": "2026-10-04"
    },
    {
      "id": "bogota-d2-livenation",
      "title": "BTS featured setlist — Bogotá, 3 Oct 2026",
      "publisher": "Live Nation",
      "url": "https://www.livenation.com/artist/K8vZ917KpXV/bts-events",
      "type": "show-setlist",
      "authority": "secondary",
      "accessedAt": "2026-10-04"
    },
    {
      "id": "bogota-d2-setlistfm",
      "title": "BTS at Estadio El Campín — 3 Oct 2026",
      "publisher": "setlist.fm",
      "url": "https://www.setlist.fm/venue/estadio-el-campin-bogota-colombia-63d636ff.html?venue=63d636ff",
      "type": "show-setlist",
      "authority": "secondary",
      "accessedAt": "2026-10-04"
    },
    {
      "id": "lima-d1-setlistfm",
      "title": "BTS at Estadio San Marcos — 7 Oct 2026",
      "publisher": "setlist.fm",
      "url": "https://www.setlist.fm/setlist/bts/2026/estadio-san-marcos-lima-peru-1b763d30.html",
      "type": "show-setlist",
      "authority": "secondary",
      "accessedAt": "2026-10-09"
    },
    {
      "id": "lima-d1-infobae",
      "title": "Setlist de BTS en Lima — primer concierto",
      "publisher": "Infobae Perú",
      "url": "https://www.infobae.com/peru/2026/10/09/setlist-de-bts-en-lima-las-canciones-que-cantaran-este-9-y-10-de-octubre-en-el-estadio-san-marcos/",
      "type": "local-concert-report",
      "authority": "secondary",
      "accessedAt": "2026-10-09"
    },
    {
      "id": "lima-d1-fantree",
      "title": "BTS ARIRANG Surprise Songs — Lima D1",
      "publisher": "Fantree",
      "url": "https://fantree.org/bts/p/bts-arirang-setlist-surprise-song-tracker",
      "type": "consolidated-setlist-tracker",
      "authority": "secondary",
      "accessedAt": "2026-10-09"
    },
    {
      "id": "lima-d2-radioz",
      "title": "BTS Lima segundo concierto 9 octubre 2026",
      "publisher": "Radio Z Rock & Pop",
      "url": "https://www.radioz.pe/",
      "type": "local-concert-report",
      "authority": "secondary",
      "accessedAt": "2026-10-10"
    },
    {
      "id": "lima-d2-setlistfm",
      "title": "BTS at Estadio San Marcos — 9 Oct 2026",
      "publisher": "setlist.fm",
      "url": "https://www.setlist.fm/search?query=BTS+Lima+2026-10-09",
      "type": "show-setlist",
      "authority": "secondary",
      "accessedAt": "2026-10-10"
    },
    {
      "id": "lima-d3-user-report",
      "title": "Lima D3 surprise songs — user-reported, awaiting independent corroboration",
      "publisher": "Tracker contributor report",